{
  "v": 1,
  "id": "3f0c1d9e-6a57-4e57-9d64-2b1b4f0f6c11",
  "destination": "anki",
  "note": "漢字の読み方を覚える",
  "quote": "Ärger über Straße ... [naïve] café",
  "selection": "Ärger über Straße und naïve café 🙂",
  "source": {
    "url": "https://debezium.io/documentation/reference/stable/architecture.html",
    "title": "Debezium Architecture",
    "video_seconds": null
  },
  "captured_at": "2026-09-24T03:12:45.120Z"
}
