{
  "v": 1,
  "id": "3f0c1d9e-6a57-4e57-9d64-2b1b4f0f6c11",
  "destination": "anki",
  "note": "The talk's point about backpressure",
  "quote": null,
  "selection": null,
  "source": {
    "url": "https://www.youtube.com/watch?v=dQw4w9WgXcQ",
    "title": "Backpressure explained",
    "video_seconds": 754.38
  },
  "captured_at": "2026-09-24T03:12:45.120Z"
}
